{
  "envelopeVersion": 1,
  "eventId": "8b2d3a4f-5c6e-4d7f-9a01-b2c3d4e5f607",
  "eventType": "alert",
  "schemaVersion": 1,
  "deviceId": "00000000-0000-0000-0000-000000010601",
  "busId": "00000000-0000-0000-0000-000000010301",
  "tripId": null,
  "deviceTimestamp": "2026-09-19T08:31:02Z",
  "ingestedAt": "2026-09-19T08:31:03Z",
  "source": { "adapter": "mqtt", "gateway": "telemetry-service-1" },
  "payload": {
    "code": "TYRE_PRESSURE_LOW",
    "state": "raised",
    "severity": "warning",
    "component": "RRO",
    "message": "Tyre RRO under-inflated"
  }
}
